{
  "model_version": "0.1.0",
  "model_family": "inc15c6d-hhs-historical-source-coverage-register",
  "department_canonical_id": "ORG-FED-EXE-DEP-HHS",
  "predecessor_hhs_index_name_records": 29,
  "predecessor_govman_2025_hhs_subentries": 11,
  "predecessor_oig_internal_publisher_groups": 6,
  "historical_hhs_exception_source_references": 4,
  "five_original_pdf_source_editions": 5,
  "historical_publisher_research_observations": 34,
  "current_hhs_legal_first_level_denominator": null,
  "source_scoped_populations_not_additive": true,
  "retained_originals_not_canonical_legal_structure_certification": true,
  "exact_historical_as_of_dates_cannot_be_used_as_current": true,
  "independent_verified_legal_identities_created": 0,
  "cross_institution_adjudicative_edges_certified": 0,
  "executed_arpah_eight_office_plan_certified": false,
  "items": [
    {
      "id": "INC15C6D-SOURCE-COVERAGE-01",
      "source_key": "dab_2012_notice",
      "source_subject": "DAB",
      "publisher_historical_edition": "2012-03-02",
      "source_scoped_observation_count": 6,
      "observed_population_scope": "selected_notice_structural_labels",
      "prior_hhs_exception_reference": "INC15C6-HHS-EXCEPTION-DAB",
      "retained_original_verified_in_git": true,
      "current_organizational_denominator": null,
      "no_addition_across_different_editions": true,
      "all_reported_labels_legally_qualified": false,
      "current_mission_or_adjudicative_authority_certified": false,
      "independently_confirmed_2026_structure": false
    },
    {
      "id": "INC15C6D-SOURCE-COVERAGE-02",
      "source_key": "omha_2005_notice",
      "source_subject": "OMHA",
      "publisher_historical_edition": "2005-06-23",
      "source_scoped_observation_count": 6,
      "observed_population_scope": "selected_notice_offices_and_field_group",
      "prior_hhs_exception_reference": "INC15C6-HHS-EXCEPTION-OMHA",
      "retained_original_verified_in_git": true,
      "current_organizational_denominator": null,
      "no_addition_across_different_editions": true,
      "all_reported_labels_legally_qualified": false,
      "current_mission_or_adjudicative_authority_certified": false,
      "independently_confirmed_2026_structure": false
    },
    {
      "id": "INC15C6D-SOURCE-COVERAGE-03",
      "source_key": "omha_2015_notice",
      "source_subject": "OMHA",
      "publisher_historical_edition": "2015-01-20",
      "source_scoped_observation_count": 4,
      "observed_population_scope": "selected_notice_revised_headquarters_and_field_group",
      "prior_hhs_exception_reference": "INC15C6-HHS-EXCEPTION-OMHA",
      "retained_original_verified_in_git": true,
      "current_organizational_denominator": null,
      "no_addition_across_different_editions": true,
      "all_reported_labels_legally_qualified": false,
      "current_mission_or_adjudicative_authority_certified": false,
      "independently_confirmed_2026_structure": false
    },
    {
      "id": "INC15C6D-SOURCE-COVERAGE-04",
      "source_key": "arpah_2022_notice",
      "source_subject": "ARPA-H",
      "publisher_historical_edition": "2022-05-27",
      "source_scoped_observation_count": 3,
      "observed_population_scope": "selected_initial_establishment_notice_labels_not_exhaustive",
      "prior_hhs_exception_reference": "INC15C6-HHS-EXCEPTION-ARPAH",
      "retained_original_verified_in_git": true,
      "current_organizational_denominator": null,
      "no_addition_across_different_editions": true,
      "all_reported_labels_legally_qualified": false,
      "current_mission_or_adjudicative_authority_certified": false,
      "independently_confirmed_2026_structure": false
    },
    {
      "id": "INC15C6D-SOURCE-COVERAGE-05",
      "source_key": "arpah_fy2025_cj",
      "source_subject": "ARPA-H",
      "publisher_historical_edition": "FY2025_budget_request_published_2024",
      "source_scoped_observation_count": 15,
      "observed_population_scope": "visually_complete_publisher_chart_boxes_not_implemented_roster",
      "prior_hhs_exception_reference": "INC15C6-HHS-EXCEPTION-ARPAH",
      "retained_original_verified_in_git": true,
      "current_organizational_denominator": null,
      "no_addition_across_different_editions": true,
      "all_reported_labels_legally_qualified": false,
      "current_mission_or_adjudicative_authority_certified": false,
      "independently_confirmed_2026_structure": false
    }
  ]
}
